{"buyer":{"id":"entity:buyer:GB-PPON-PHMT-6197-NWNZ","name":"Transport for London","role":"buyer","source_identifier":"GB-PPON-PHMT-6197-NWNZ"},"classification":{"category":null,"cpv":[]},"dates":{"award":"2026-07-01T00:00:00+01:00","end":"2029-08-31T23:59:59+01:00","first_observed":"2026-08-12T15:26:12+00:00","first_observed_changed":"2026-08-13T03:28:40+00:00","last_observed":"2026-08-12T21:27:49+00:00","published":"2026-08-12T15:23:21+01:00","start":"2026-09-01T00:00:00+01:00"},"evidence":{"observation_count":2,"observation_ids":["find-a-tender-recent-awards:poll:227","find-a-tender-recent-awards:poll:238"]},"id":"record:find-a-tender-recent-awards:ocds-h6vhtk-06e22c","notice_type":"award","source":{"name":"Find a Tender \u2014 recent awards","notice_url":"https://www.find-tender.service.gov.uk/Notice/076893-2026","target_id":"find-a-tender-recent-awards","url":"https://www.find-tender.service.gov.uk/api/1.0/ocdsReleasePackages"},"status":"active","supplier":{"id":"entity:supplier:GB-COH-01679046","name":"THOMSON REUTERS (PROFESSIONAL) UK LIMITED","role":"supplier","source_identifier":"GB-COH-01679046"},"suppliers":[{"id":"entity:supplier:GB-COH-01679046","name":"THOMSON REUTERS (PROFESSIONAL) UK LIMITED","role":"supplier","source_identifier":"GB-COH-01679046"}],"title":"Legal Online Subscription","type":"award","value":null}
