{"buyer":{"id":"entity:buyer:GB-CFS-283655","name":"Wirral Borough Council","role":"buyer","source_identifier":"GB-CFS-283655"},"classification":{"category":"IT services: consulting, software development, Internet and support","cpv":[{"code":"72000000","description":"IT services: consulting, software development, Internet and support"}]},"dates":{"award":"2026-07-31T00:00:00+01:00","end":"2027-07-31T23:59:59+01:00","first_observed":"2026-08-11T15:49:51+00:00","first_observed_changed":"2026-08-12T15:26:10+00:00","last_observed":"2026-08-12T09:25:40+00:00","published":"2026-08-11T15:24:06+01:00","start":"2026-08-01T00:00:00+01:00"},"evidence":{"observation_count":6,"observation_ids":["contracts-finder-recent-awards:poll:173","contracts-finder-recent-awards:poll:184","contracts-finder-recent-awards:poll:195","contracts-finder-recent-awards:poll:202","contracts-finder-recent-awards:poll:209","contracts-finder-recent-awards:poll:215"]},"id":"record:contracts-finder-recent-awards:ocds-b5fd17-ebaa0849-97d3-40bb-a53d-ffcd2ecce9d1","notice_type":"award","source":{"name":"Contracts Finder \u2014 recent awards","notice_url":"https://www.contractsfinder.service.gov.uk/Notice/f8064dda-52ec-4aa5-84b1-ae06d4d95a5e","target_id":"contracts-finder-recent-awards","url":"https://www.contractsfinder.service.gov.uk/Published/Notices/OCDS/Search?stages=award"},"status":"active","supplier":{"id":"entity:supplier:GB-CFS-337422","name":"TTEC Consulting (UK) Limited","role":"supplier","source_identifier":"GB-CFS-337422"},"suppliers":[{"id":"entity:supplier:GB-CFS-337422","name":"TTEC Consulting (UK) Limited","role":"supplier","source_identifier":"GB-CFS-337422"}],"title":"Telephony Modernisation","type":"award","value":{"amount":343692,"currency":"GBP"}}
