{"buyer":{"id":"entity:buyer:GB-CFS-153240","name":"Department of Health and Social Care","role":"buyer","source_identifier":"GB-CFS-153240"},"classification":{"category":"Recruitment services","cpv":[{"code":"79600000","description":"Recruitment services"}]},"dates":{"award":"2026-08-04T00:00:00+01:00","end":"2027-03-01T23:59:59Z","first_observed":"2026-08-04T21:15:47+00:00","first_observed_changed":"2026-08-05T18:53:06+00:00","last_observed":"2026-08-05T10:16:11+00:00","published":"2026-08-04T14:56:03+01:00","start":"2026-07-17T00:00:00+01:00"},"evidence":{"observation_count":5,"observation_ids":["contracts-finder-recent-awards:poll:99","contracts-finder-recent-awards:poll:105","contracts-finder-recent-awards:poll:115","contracts-finder-recent-awards:poll:123","contracts-finder-recent-awards:poll:129"]},"id":"record:contracts-finder-recent-awards:ocds-b5fd17-dde04437-f1ed-442e-8d28-629a602a1615","notice_type":"award","source":{"name":"Contracts Finder \u2014 recent awards","notice_url":"https://www.contractsfinder.service.gov.uk/Notice/2c4c72ed-947e-40c0-891f-8ab0d3283e5d","target_id":"contracts-finder-recent-awards","url":"https://www.contractsfinder.service.gov.uk/Published/Notices/OCDS/Search?stages=award"},"status":"active","supplier":{"id":"entity:supplier:GB-CFS-337252","name":"Odgers Berndtson","role":"supplier","source_identifier":"GB-CFS-337252"},"suppliers":[{"id":"entity:supplier:GB-CFS-337252","name":"Odgers Berndtson","role":"supplier","source_identifier":"GB-CFS-337252"}],"title":"DHSC: UKHSA Chair campaign","type":"award","value":{"amount":26000,"currency":"GBP"}}
