{"buyer":{"id":"entity:buyer:GB-PPON-PTHC-5561-MHMM","name":"Chichester City Council","role":"buyer","source_identifier":"GB-PPON-PTHC-5561-MHMM"},"classification":{"category":null,"cpv":[]},"dates":{"award":"2026-08-12T00:00:00+01:00","end":"2026-12-31T23:59:59Z","first_observed":"2026-08-12T21:27:49+00:00","first_observed_changed":"2026-08-13T09:29:05+00:00","last_observed":"2026-08-13T03:28:40+00:00","published":"2026-08-12T16:28:04+01:00","start":"2026-10-01T00:00:00+01:00"},"evidence":{"observation_count":2,"observation_ids":["find-a-tender-recent-awards:poll:238","find-a-tender-recent-awards:poll:246"]},"id":"record:find-a-tender-recent-awards:ocds-h6vhtk-06a150","notice_type":"award","source":{"name":"Find a Tender \u2014 recent awards","notice_url":"https://www.find-tender.service.gov.uk/Notice/076949-2026","target_id":"find-a-tender-recent-awards","url":"https://www.find-tender.service.gov.uk/api/1.0/ocdsReleasePackages"},"status":"pending","supplier":{"id":"entity:supplier:GB-COH-04296029","name":"Adams & Sutherland","role":"supplier","source_identifier":"GB-COH-04296029"},"suppliers":[{"id":"entity:supplier:GB-COH-04296029","name":"Adams & Sutherland","role":"supplier","source_identifier":"GB-COH-04296029"}],"title":"Design element for the new development of Florence Park Sea Cadet and Community Centre, Chichester","type":"award","value":{"amount":326277.4,"amountGross":391532.88,"currency":"GBP"}}
