{"buyer":{"id":"entity:buyer:GB-CFS-337510","name":"South Gloucestershire Council","role":"buyer","source_identifier":"GB-CFS-337510"},"classification":{"category":"Bus shelters","cpv":[{"code":"44212321","description":"Bus shelters"}]},"dates":{"award":"2026-04-14T00:00:00+01:00","end":"2028-03-31T23:59:59+01:00","first_observed":"2026-08-13T15:29:21+00:00","first_observed_changed":null,"last_observed":"2026-08-14T03:29:49+00:00","published":"2026-08-13T14:37:50+01:00","start":"2026-07-23T00:00:00+01:00"},"evidence":{"observation_count":3,"observation_ids":["contracts-finder-recent-awards:poll:264","contracts-finder-recent-awards:poll:275","contracts-finder-recent-awards:poll:283"]},"id":"record:contracts-finder-recent-awards:ocds-b5fd17-84971342-4f07-4d22-9ba8-fb175456f696","notice_type":"award","source":{"name":"Contracts Finder \u2014 recent awards","notice_url":"https://www.contractsfinder.service.gov.uk/Notice/0987f33f-ba38-4160-91a1-500072daff84","target_id":"contracts-finder-recent-awards","url":"https://www.contractsfinder.service.gov.uk/Published/Notices/OCDS/Search?stages=award"},"status":"active","supplier":{"id":"entity:supplier:GB-CFS-334731","name":"Bus Shelters Limited","role":"supplier","source_identifier":"GB-CFS-334731"},"suppliers":[{"id":"entity:supplier:GB-CFS-334731","name":"Bus Shelters Limited","role":"supplier","source_identifier":"GB-CFS-334731"}],"title":"Bus Shelters A432  - Additional Bus Shelters on A432 Scheme","type":"award","value":{"amount":95687.84,"currency":"GBP"}}
