{"buyer":{"id":"entity:buyer:GB-SRS-sid4gov.cabinetoffice.gov.uk/3ZkU44F8","name":"University of Brighton","role":"buyer","source_identifier":"GB-SRS-sid4gov.cabinetoffice.gov.uk/3ZkU44F8"},"classification":{"category":"Refuse and waste related services","cpv":[{"code":"90500000","description":"Refuse and waste related services"}]},"dates":{"award":"2026-04-14T00:00:00+01:00","end":"2029-07-31T23:59:59+01:00","first_observed":"2026-08-12T15:26:10+00:00","first_observed_changed":"2026-08-13T15:29:21+00:00","last_observed":"2026-08-13T09:29:02+00:00","published":"2026-08-12T16:01:58+01:00","start":"2026-08-01T00:00:00+01:00"},"evidence":{"observation_count":4,"observation_ids":["contracts-finder-recent-awards:poll:226","contracts-finder-recent-awards:poll:237","contracts-finder-recent-awards:poll:245","contracts-finder-recent-awards:poll:256"]},"id":"record:contracts-finder-recent-awards:ocds-b5fd17-126488cb-ea60-4b9d-a631-9df367a8cbec","notice_type":"award","source":{"name":"Contracts Finder \u2014 recent awards","notice_url":"https://www.contractsfinder.service.gov.uk/Notice/dfaf949f-c0cb-4ae4-a90c-a7d281986e8d","target_id":"contracts-finder-recent-awards","url":"https://www.contractsfinder.service.gov.uk/Published/Notices/OCDS/Search?stages=award"},"status":"active","supplier":{"id":"entity:supplier:GB-COH-04245965","name":"Grundon Waste Management Limited","role":"supplier","source_identifier":"GB-COH-04245965"},"suppliers":[{"id":"entity:supplier:GB-COH-04245965","name":"Grundon Waste Management Limited","role":"supplier","source_identifier":"GB-COH-04245965"}],"title":"Waste and Recycling Management Services","type":"award","value":{"amount":682817.66,"currency":"GBP"}}
