{"buyer":{"id":"entity:buyer:GB-CFS-154927","name":"Suffolk County Council Passenger Transport","role":"buyer","source_identifier":"GB-CFS-154927"},"classification":{"category":"Transport services (excl. Waste transport)","cpv":[{"code":"60000000","description":"Transport services (excl. Waste transport)"}]},"dates":{"award":"2026-07-28T00:00:00+01:00","end":"2031-07-31T23:59:59+01:00","first_observed":"2026-08-03T11:43:20+00:00","first_observed_changed":"2026-08-04T21:15:47+00:00","last_observed":"2026-08-03T20:19:28+00:00","published":"2026-07-28T15:03:22+01:00","start":"2026-09-01T00:00:00+01:00"},"evidence":{"observation_count":3,"observation_ids":["contracts-finder-recent-awards:poll:73","contracts-finder-recent-awards:poll:80","contracts-finder-recent-awards:poll:89"]},"id":"record:contracts-finder-recent-awards:ocds-b5fd17-8bd5fc69-00da-442c-bb2b-f03bd0ffc44e","notice_type":"awardUpdate","source":{"name":"Contracts Finder \u2014 recent awards","notice_url":"https://www.contractsfinder.service.gov.uk/Notice/990fecc5-2ff5-4339-9e7a-739822964720","target_id":"contracts-finder-recent-awards","url":"https://www.contractsfinder.service.gov.uk/Published/Notices/OCDS/Search?stages=award"},"status":"active","supplier":{"id":"entity:supplier:GB-CFS-323607","name":"GROUND TRAVEL -IPSWICH LTD","role":"supplier","source_identifier":"GB-CFS-323607"},"suppliers":[{"id":"entity:supplier:GB-CFS-323607","name":"GROUND TRAVEL -IPSWICH LTD","role":"supplier","source_identifier":"GB-CFS-323607"}],"title":"QSB202 0900 2026-07-27 Ipswich - Olive academy, Stowmarket (4-seated vehicle required) - AWARD","type":"award","value":{"amount":93670,"currency":"GBP"}}
