{"buyer":{"id":"entity:buyer:GB-COH-02732548","name":"LONDONENERGY LTD","role":"buyer","source_identifier":"GB-COH-02732548"},"classification":{"category":null,"cpv":[]},"dates":{"award":"2026-08-03T00:00:00+01:00","end":"2026-12-31T23:59:59Z","first_observed":"2026-08-03T10:31:15+00:00","first_observed_changed":"2026-08-03T11:43:22+00:00","last_observed":"2026-08-03T11:43:22+00:00","published":"2026-08-03T11:21:26+01:00","start":"2026-08-22T00:00:00+01:00"},"evidence":{"observation_count":2,"observation_ids":["find-a-tender-recent-awards:poll:67","find-a-tender-recent-awards:poll:74"]},"id":"record:find-a-tender-recent-awards:ocds-h6vhtk-06b7a2","notice_type":"award","source":{"name":"Find a Tender \u2014 recent awards","notice_url":"https://www.find-tender.service.gov.uk/Notice/073076-2026","target_id":"find-a-tender-recent-awards","url":"https://www.find-tender.service.gov.uk/api/1.0/ocdsReleasePackages"},"status":"pending","supplier":{"id":"entity:supplier:GB-COH-NI014026","name":"W.H. SCOTT & SON (ENGINEERS) LIMITED","role":"supplier","source_identifier":"GB-COH-NI014026"},"suppliers":[{"id":"entity:supplier:GB-COH-NI014026","name":"W.H. SCOTT & SON (ENGINEERS) LIMITED","role":"supplier","source_identifier":"GB-COH-NI014026"}],"title":"Provision of replacement Crane Gantry Cabs","type":"award","value":{"amount":290000,"amountGross":348000,"currency":"GBP"}}
