{"buyer":{"id":"entity:buyer:GB-UKPRN-10007164","name":"University of the West of England","role":"buyer","source_identifier":"GB-UKPRN-10007164"},"classification":{"category":null,"cpv":[]},"dates":{"award":null,"end":null,"first_observed":"2026-08-11T15:49:52+00:00","first_observed_changed":"2026-08-11T21:50:38+00:00","last_observed":"2026-08-11T15:49:52+00:00","published":"2026-08-11T15:37:48+01:00","start":null},"evidence":{"observation_count":1,"observation_ids":["find-a-tender-recent-awards:poll:174"]},"id":"record:find-a-tender-recent-awards:ocds-h6vhtk-06e1a9","notice_type":"award","source":{"name":"Find a Tender \u2014 recent awards","notice_url":null,"target_id":"find-a-tender-recent-awards","url":"https://www.find-tender.service.gov.uk/api/1.0/ocdsReleasePackages"},"status":"active","supplier":{"id":"entity:supplier:GB-COH-01633646","name":"L.A. INTERNATIONAL COMPUTER CONSULTANTS LIMITED","role":"supplier","source_identifier":"GB-COH-01633646"},"suppliers":[{"id":"entity:supplier:GB-COH-01633646","name":"L.A. INTERNATIONAL COMPUTER CONSULTANTS LIMITED","role":"supplier","source_identifier":"GB-COH-01633646"}],"title":"Business Analyst","type":"award","value":null}
