{"buyer":{"id":"entity:buyer:GB-SRS-sid4gov.cabinetoffice.gov.uk/Qn752tMx","name":"SURREY COUNTY COUNCIL","role":"buyer","source_identifier":"GB-SRS-sid4gov.cabinetoffice.gov.uk/Qn752tMx"},"classification":{"category":"Quantity surveying services","cpv":[{"code":"71324000","description":"Quantity surveying services"}]},"dates":{"award":"2026-07-31T00:00:00+01:00","end":"2027-09-30T23:59:59+01:00","first_observed":"2026-08-01T16:52:42+00:00","first_observed_changed":"2026-08-03T10:31:12+00:00","last_observed":"2026-08-03T09:17:01+00:00","published":"2026-07-31T13:11:41+01:00","start":"2026-06-08T00:00:00+01:00"},"evidence":{"observation_count":8,"observation_ids":["contracts-finder-recent-awards:poll:1","contracts-finder-recent-awards:poll:6","contracts-finder-recent-awards:poll:33","contracts-finder-recent-awards:poll:41","contracts-finder-recent-awards:poll:46","contracts-finder-recent-awards:poll:51","contracts-finder-recent-awards:poll:56","contracts-finder-recent-awards:poll:61"]},"id":"record:contracts-finder-recent-awards:ocds-b5fd17-4fd2bda1-78a8-4b36-a389-b1f97d5a60bb","notice_type":"award","source":{"name":"Contracts Finder \u2014 recent awards","notice_url":"https://www.contractsfinder.service.gov.uk/Notice/6898fa99-634a-4691-92d9-defda4c4648b","target_id":"contracts-finder-recent-awards","url":"https://www.contractsfinder.service.gov.uk/Published/Notices/OCDS/Search?stages=award"},"status":"active","supplier":{"id":"entity:supplier:GB-CFS-337160","name":"AtkinsR\u00e9alis PPS Limited","role":"supplier","source_identifier":"GB-CFS-337160"},"suppliers":[{"id":"entity:supplier:GB-CFS-337160","name":"AtkinsR\u00e9alis PPS Limited","role":"supplier","source_identifier":"GB-CFS-337160"}],"title":"SCC - KC - Oakwood School Phase 3 Lot 2A CM Services (RIBA 4-6)","type":"award","value":{"amount":0,"currency":"GBP"}}
