{"buyer":{"id":"entity:buyer:GB-PPON-PVRY-5141-LLTP","name":"Bournemouth University","role":"buyer","source_identifier":"GB-PPON-PVRY-5141-LLTP"},"classification":{"category":null,"cpv":[]},"dates":{"award":null,"end":null,"first_observed":"2026-08-01T16:52:49+00:00","first_observed_changed":"2026-08-03T09:17:06+00:00","last_observed":"2026-08-02T16:20:22+00:00","published":"2026-07-31T18:03:30+01:00","start":null},"evidence":{"observation_count":7,"observation_ids":["find-a-tender-recent-awards:poll:2","find-a-tender-recent-awards:poll:7","find-a-tender-recent-awards:poll:34","find-a-tender-recent-awards:poll:42","find-a-tender-recent-awards:poll:47","find-a-tender-recent-awards:poll:52","find-a-tender-recent-awards:poll:57"]},"id":"record:find-a-tender-recent-awards:ocds-h6vhtk-06d959","notice_type":"award","source":{"name":"Find a Tender \u2014 recent awards","notice_url":null,"target_id":"find-a-tender-recent-awards","url":"https://www.find-tender.service.gov.uk/api/1.0/ocdsReleasePackages"},"status":"active","supplier":{"id":"entity:supplier:GB-COH-15343474","name":"HIGHER FUTURES LTD","role":"supplier","source_identifier":"GB-COH-15343474"},"suppliers":[{"id":"entity:supplier:GB-COH-15343474","name":"HIGHER FUTURES LTD","role":"supplier","source_identifier":"GB-COH-15343474"}],"title":"Consultancy Services to Assess the Potential for Medical Education","type":"award","value":null}
