{"buyer":{"id":"entity:buyer:GB-CFS-324051","name":"Worcestershire Acute Hospitals NHS Trust","role":"buyer","source_identifier":"GB-CFS-324051"},"classification":{"category":"Medical consumables","cpv":[{"code":"33140000","description":"Medical consumables"}]},"dates":{"award":"2026-07-23T00:00:00+01:00","end":"2030-07-31T23:59:59+01:00","first_observed":"2026-08-03T20:19:28+00:00","first_observed_changed":"2026-08-04T21:15:47+00:00","last_observed":"2026-08-03T20:19:28+00:00","published":"2026-08-03T17:26:19+01:00","start":"2026-08-01T00:00:00+01:00"},"evidence":{"observation_count":1,"observation_ids":["contracts-finder-recent-awards:poll:89"]},"id":"record:contracts-finder-recent-awards:ocds-b5fd17-6e64e5c4-5cb5-4740-9d75-b41753670b46","notice_type":"award","source":{"name":"Contracts Finder \u2014 recent awards","notice_url":"https://www.contractsfinder.service.gov.uk/Notice/1e7f99c0-ba98-4a1f-9ca3-a4b7d2558c11","target_id":"contracts-finder-recent-awards","url":"https://www.contractsfinder.service.gov.uk/Published/Notices/OCDS/Search?stages=award"},"status":"active","supplier":{"id":"entity:supplier:GB-CFS-336646","name":"Welfare Medical Limited","role":"supplier","source_identifier":"GB-CFS-336646"},"suppliers":[{"id":"entity:supplier:GB-CFS-336646","name":"Welfare Medical Limited","role":"supplier","source_identifier":"GB-CFS-336646"}],"title":"Laparoscopic Ligation Clips & Appliers","type":"award","value":{"amount":150000,"currency":"GBP"}}
