{"buyer":{"id":"entity:buyer:GB-CFS-330069","name":"Trafford Council","role":"buyer","source_identifier":"GB-CFS-330069"},"classification":{"category":"Architectural, construction, engineering and inspection services","cpv":[{"code":"71000000","description":"Architectural, construction, engineering and inspection services"}]},"dates":{"award":"2026-07-13T00:00:00+01:00","end":"2026-11-03T23:59:59Z","first_observed":"2026-08-03T09:17:01+00:00","first_observed_changed":"2026-08-04T21:15:47+00:00","last_observed":"2026-08-03T20:19:28+00:00","published":"2026-08-03T08:43:54+01:00","start":"2026-08-04T00:00:00+01:00"},"evidence":{"observation_count":5,"observation_ids":["contracts-finder-recent-awards:poll:61","contracts-finder-recent-awards:poll:66","contracts-finder-recent-awards:poll:73","contracts-finder-recent-awards:poll:80","contracts-finder-recent-awards:poll:89"]},"id":"record:contracts-finder-recent-awards:ocds-b5fd17-08eb241f-187e-4eea-8f94-48c1cfa038a8","notice_type":"award","source":{"name":"Contracts Finder \u2014 recent awards","notice_url":"https://www.contractsfinder.service.gov.uk/Notice/b3b6cc58-e7e0-482d-b01f-23bc7ec7477d","target_id":"contracts-finder-recent-awards","url":"https://www.contractsfinder.service.gov.uk/Published/Notices/OCDS/Search?stages=award"},"status":"active","supplier":{"id":"entity:supplier:GB-CFS-337190","name":"Buttress Architects Ltd","role":"supplier","source_identifier":"GB-CFS-337190"},"suppliers":[{"id":"entity:supplier:GB-CFS-337190","name":"Buttress Architects Ltd","role":"supplier","source_identifier":"GB-CFS-337190"}],"title":"020609 - Central Rd Partington Stage 3 Design","type":"award","value":{"amount":95700,"currency":"GBP"}}
