{"buyer":{"id":"entity:buyer:GB-PPON-PWRH-8974-TNBV","name":"Surrey County Council","role":"buyer","source_identifier":"GB-PPON-PWRH-8974-TNBV"},"classification":{"category":null,"cpv":[]},"dates":{"award":null,"end":null,"first_observed":"2026-08-03T11:43:22+00:00","first_observed_changed":"2026-08-03T15:18:30+00:00","last_observed":"2026-08-03T11:43:22+00:00","published":"2026-08-03T12:12:49+01:00","start":null},"evidence":{"observation_count":1,"observation_ids":["find-a-tender-recent-awards:poll:74"]},"id":"record:find-a-tender-recent-awards:ocds-h6vhtk-06d9cc","notice_type":"award","source":{"name":"Find a Tender \u2014 recent awards","notice_url":null,"target_id":"find-a-tender-recent-awards","url":"https://www.find-tender.service.gov.uk/api/1.0/ocdsReleasePackages"},"status":"active","supplier":{"id":"entity:supplier:GB-FTS-105720","name":"Green line cars","role":"supplier","source_identifier":"GB-FTS-105720"},"suppliers":[{"id":"entity:supplier:GB-FTS-105720","name":"Green line cars","role":"supplier","source_identifier":"GB-FTS-105720"}],"title":"Client Transport Services 2026 - 2034 - SEND","type":"award","value":null}
