{"buyer":{"id":"entity:buyer:GB-PPON-PXWV-6492-CGMN","name":"NHS Wales Shared Services Partnership-Procurement Services (hosted by Velindre University NHS Trust)","role":"buyer","source_identifier":"GB-PPON-PXWV-6492-CGMN"},"classification":{"category":null,"cpv":[]},"dates":{"award":null,"end":"2027-08-18T23:59:59+01:00","first_observed":"2026-08-03T09:17:06+00:00","first_observed_changed":"2026-08-03T11:43:22+00:00","last_observed":"2026-08-03T10:31:15+00:00","published":"2026-08-03T10:04:48+01:00","start":"2026-08-19T00:00:00+01:00"},"evidence":{"observation_count":2,"observation_ids":["find-a-tender-recent-awards:poll:62","find-a-tender-recent-awards:poll:67"]},"id":"record:find-a-tender-recent-awards:ocds-h6vhtk-06d9a2","notice_type":"award","source":{"name":"Find a Tender \u2014 recent awards","notice_url":"https://www.find-tender.service.gov.uk/Notice/073031-2026","target_id":"find-a-tender-recent-awards","url":"https://www.find-tender.service.gov.uk/api/1.0/ocdsReleasePackages"},"status":"pending","supplier":{"id":"entity:supplier:GB-PPON-PZVH-5599-PTRY","name":"National Grid South Wales","role":"supplier","source_identifier":"GB-PPON-PZVH-5599-PTRY"},"suppliers":[{"id":"entity:supplier:GB-PPON-PZVH-5599-PTRY","name":"National Grid South Wales","role":"supplier","source_identifier":"GB-PPON-PZVH-5599-PTRY"}],"title":"High Voltage Switchgear Warranty Support, Maintenance & Emergency Response Services","type":"award","value":{"amount":26715.0,"amountGross":32058.0,"currency":"GBP"}}
