{"buyer":{"id":"entity:buyer:GB-PPON-PVWZ-3216-PVQL","name":"Department for Science, Innovation & Technology","role":"buyer","source_identifier":"GB-PPON-PVWZ-3216-PVQL"},"classification":{"category":null,"cpv":[]},"dates":{"award":"2026-08-12T00:00:00+01:00","end":"2027-08-25T23:59:59+01:00","first_observed":"2026-08-04T21:15:49+00:00","first_observed_changed":"2026-08-05T08:06:56+00:00","last_observed":"2026-08-13T03:28:40+00:00","published":"2026-08-12T15:36:01+01:00","start":"2026-08-26T00:00:00+01:00"},"evidence":{"observation_count":5,"observation_ids":["find-a-tender-recent-awards:poll:100","find-a-tender-recent-awards:poll:106","find-a-tender-recent-awards:poll:227","find-a-tender-recent-awards:poll:238","find-a-tender-recent-awards:poll:246"]},"id":"record:find-a-tender-recent-awards:ocds-h6vhtk-06db98","notice_type":"award","source":{"name":"Find a Tender \u2014 recent awards","notice_url":"https://www.find-tender.service.gov.uk/Notice/076906-2026","target_id":"find-a-tender-recent-awards","url":"https://www.find-tender.service.gov.uk/api/1.0/ocdsReleasePackages"},"status":"active","supplier":{"id":"entity:supplier:GB-PPON-PDZX-5167-YGDN","name":"Revelio Labs","role":"supplier","source_identifier":"GB-PPON-PDZX-5167-YGDN"},"suppliers":[{"id":"entity:supplier:GB-PPON-PDZX-5167-YGDN","name":"Revelio Labs","role":"supplier","source_identifier":"GB-PPON-PDZX-5167-YGDN"}],"title":"DSIT -  Revelio Labs","type":"award","value":{"amount":80000,"amountGross":96000,"currency":"GBP"}}
