{"buyer":{"id":"entity:buyer:GB-PPON-PDZN-8179-PJQV","name":"The Council of the City of Wakefield","role":"buyer","source_identifier":"GB-PPON-PDZN-8179-PJQV"},"classification":{"category":null,"cpv":[]},"dates":{"award":null,"end":null,"first_observed":"2026-08-03T15:18:30+00:00","first_observed_changed":"2026-08-03T20:19:30+00:00","last_observed":"2026-08-03T15:18:30+00:00","published":"2026-08-03T15:25:28+01:00","start":null},"evidence":{"observation_count":1,"observation_ids":["find-a-tender-recent-awards:poll:81"]},"id":"record:find-a-tender-recent-awards:ocds-h6vhtk-06da32","notice_type":"award","source":{"name":"Find a Tender \u2014 recent awards","notice_url":null,"target_id":"find-a-tender-recent-awards","url":"https://www.find-tender.service.gov.uk/api/1.0/ocdsReleasePackages"},"status":"active","supplier":{"id":"entity:supplier:GB-COH-00264322","name":"BETHELL CONSTRUCTION LIMITED","role":"supplier","source_identifier":"GB-COH-00264322"},"suppliers":[{"id":"entity:supplier:GB-COH-00264322","name":"BETHELL CONSTRUCTION LIMITED","role":"supplier","source_identifier":"GB-COH-00264322"}],"title":"New Lane, Upton","type":"award","value":null}
