{"buyer":{"id":"entity:buyer:GB-FTS-151975","name":"Knowsley Council","role":"buyer","source_identifier":"GB-FTS-151975"},"classification":{"category":"Health services","cpv":[{"code":"85100000","description":"Health services"}]},"dates":{"award":null,"end":null,"first_observed":"2026-08-13T09:29:05+00:00","first_observed_changed":"2026-08-13T15:29:23+00:00","last_observed":"2026-08-13T09:29:05+00:00","published":"2026-08-13T09:12:55+01:00","start":null},"evidence":{"observation_count":1,"observation_ids":["find-a-tender-recent-awards:poll:257"]},"id":"record:find-a-tender-recent-awards:ocds-h6vhtk-066ede","notice_type":"award","source":{"name":"Find a Tender \u2014 recent awards","notice_url":null,"target_id":"find-a-tender-recent-awards","url":"https://www.find-tender.service.gov.uk/api/1.0/ocdsReleasePackages"},"status":"active","supplier":{"id":"entity:supplier:GB-FTS-185796","name":"Wirral Community Health & Care NHS Foundation Trust & Wirral University Teaching Hospital NHS Foundation Trust","role":"supplier","source_identifier":"GB-FTS-185796"},"suppliers":[{"id":"entity:supplier:GB-FTS-185796","name":"Wirral Community Health & Care NHS Foundation Trust & Wirral University Teaching Hospital NHS Foundation Trust","role":"supplier","source_identifier":"GB-FTS-185796"}],"title":"Knowsley 0-19(25) Healthy Child Programme","type":"award","value":null}
