{"buyer":{"id":"entity:buyer:GB-SRS-sid4gov.cabinetoffice.gov.uk/Zj5uFppq","name":"UK RESEARCH & INNOVATION","role":"buyer","source_identifier":"GB-SRS-sid4gov.cabinetoffice.gov.uk/Zj5uFppq"},"classification":{"category":"Project-supervision services other than for construction work","cpv":[{"code":"79421100","description":"Project-supervision services other than for construction work"}]},"dates":{"award":"2026-06-22T00:00:00+01:00","end":"2030-01-31T23:59:59Z","first_observed":"2026-08-05T18:53:06+00:00","first_observed_changed":"2026-08-06T11:54:43+00:00","last_observed":"2026-08-05T18:53:06+00:00","published":"2026-08-05T11:46:21+01:00","start":"2026-07-01T00:00:00+01:00"},"evidence":{"observation_count":1,"observation_ids":["contracts-finder-recent-awards:poll:146"]},"id":"record:contracts-finder-recent-awards:ocds-b5fd17-cd16df81-2701-43c6-8658-60ee9f5b5785","notice_type":"award","source":{"name":"Contracts Finder \u2014 recent awards","notice_url":"https://www.contractsfinder.service.gov.uk/Notice/2e3fca2d-b644-4e7c-95bc-099f68c79446","target_id":"contracts-finder-recent-awards","url":"https://www.contractsfinder.service.gov.uk/Published/Notices/OCDS/Search?stages=award"},"status":"active","supplier":{"id":"entity:supplier:GB-COH-9775120","name":"QUODIT LTD","role":"supplier","source_identifier":"GB-COH-9775120"},"suppliers":[{"id":"entity:supplier:GB-COH-9775120","name":"QUODIT LTD","role":"supplier","source_identifier":"GB-COH-9775120"}],"title":"ITT for project 10195677","type":"award","value":{"amount":7350,"currency":"GBP"}}
