{"buyer":{"id":"entity:buyer:GB-PPON-PZZJ-6312-QTTD","name":"Department for Business & Trade","role":"buyer","source_identifier":"GB-PPON-PZZJ-6312-QTTD"},"classification":{"category":null,"cpv":[]},"dates":{"award":"2026-07-31T00:00:00+01:00","end":"2028-08-17T23:59:59+01:00","first_observed":"2026-08-01T16:52:49+00:00","first_observed_changed":"2026-08-03T09:17:06+00:00","last_observed":"2026-08-02T16:20:22+00:00","published":"2026-07-31T16:51:23+01:00","start":"2026-08-17T00:00:00+01:00"},"evidence":{"observation_count":7,"observation_ids":["find-a-tender-recent-awards:poll:2","find-a-tender-recent-awards:poll:7","find-a-tender-recent-awards:poll:34","find-a-tender-recent-awards:poll:42","find-a-tender-recent-awards:poll:47","find-a-tender-recent-awards:poll:52","find-a-tender-recent-awards:poll:57"]},"id":"record:find-a-tender-recent-awards:ocds-h6vhtk-0589f1","notice_type":"award","source":{"name":"Find a Tender \u2014 recent awards","notice_url":"https://www.find-tender.service.gov.uk/Notice/072903-2026","target_id":"find-a-tender-recent-awards","url":"https://www.find-tender.service.gov.uk/api/1.0/ocdsReleasePackages"},"status":"active","supplier":null,"suppliers":[{"id":"entity:supplier:GB-PPON-PQNJ-9156-VVJH","name":"The Dot Collective","role":"supplier","source_identifier":"GB-PPON-PQNJ-9156-VVJH"},{"id":"entity:supplier:GB-PPON-PXVJ-5323-ZYVM","name":"Version 1 Solutions Limited","role":"supplier","source_identifier":"GB-PPON-PXVJ-5323-ZYVM"},{"id":"entity:supplier:GB-PPON-PHWT-4231-YGQG","name":"CACI Ltd","role":"supplier","source_identifier":"GB-PPON-PHWT-4231-YGQG"}],"title":"AI\u00b3 Delivery Partners Project","type":"award","value":{"amount":3000000,"amountGross":3600000,"currency":"GBP"}}
