{"buyer":{"id":"entity:buyer:GB-PPON-PZHT-7473-ZVPN","name":"Gloucestershire County Council","role":"buyer","source_identifier":"GB-PPON-PZHT-7473-ZVPN"},"classification":{"category":null,"cpv":[]},"dates":{"award":"2026-08-13T00:00:00+01:00","end":"2029-09-27T23:59:59+01:00","first_observed":"2026-08-13T15:29:23+00:00","first_observed_changed":null,"last_observed":"2026-08-14T03:29:51+00:00","published":"2026-08-13T15:53:11+01:00","start":"2026-09-28T00:00:00+01:00"},"evidence":{"observation_count":3,"observation_ids":["find-a-tender-recent-awards:poll:265","find-a-tender-recent-awards:poll:276","find-a-tender-recent-awards:poll:284"]},"id":"record:find-a-tender-recent-awards:ocds-h6vhtk-068f76","notice_type":"award","source":{"name":"Find a Tender \u2014 recent awards","notice_url":"https://www.find-tender.service.gov.uk/Notice/077357-2026","target_id":"find-a-tender-recent-awards","url":"https://www.find-tender.service.gov.uk/api/1.0/ocdsReleasePackages"},"status":"active","supplier":{"id":"entity:supplier:GB-COH-07841236","name":"GLOUCESTERSHIRE CARE PROVIDERS ASSOCIATION LIMITED","role":"supplier","source_identifier":"GB-COH-07841236"},"suppliers":[{"id":"entity:supplier:GB-COH-07841236","name":"GLOUCESTERSHIRE CARE PROVIDERS ASSOCIATION LIMITED","role":"supplier","source_identifier":"GB-COH-07841236"}],"title":"Provider Support & Engagement","type":"award","value":{"amount":416000,"amountGross":499200,"currency":"GBP"}}
