{"buyer":{"id":"entity:buyer:GB-CFS-154927","name":"Suffolk County Council Passenger Transport","role":"buyer","source_identifier":"GB-CFS-154927"},"classification":{"category":"Transport services (excl. Waste transport)","cpv":[{"code":"60000000","description":"Transport services (excl. Waste transport)"}]},"dates":{"award":"2026-08-11T00:00:00+01:00","end":"2028-07-31T23:59:59+01:00","first_observed":"2026-08-11T14:05:41+00:00","first_observed_changed":"2026-08-12T15:26:10+00:00","last_observed":"2026-08-12T09:25:40+00:00","published":"2026-08-11T14:21:03+01:00","start":"2026-09-01T00:00:00+01:00"},"evidence":{"observation_count":7,"observation_ids":["contracts-finder-recent-awards:poll:166","contracts-finder-recent-awards:poll:173","contracts-finder-recent-awards:poll:184","contracts-finder-recent-awards:poll:195","contracts-finder-recent-awards:poll:202","contracts-finder-recent-awards:poll:209","contracts-finder-recent-awards:poll:215"]},"id":"record:contracts-finder-recent-awards:ocds-b5fd17-37817dcf-ad20-431e-9b98-d9d8133413f6","notice_type":"award","source":{"name":"Contracts Finder \u2014 recent awards","notice_url":"https://www.contractsfinder.service.gov.uk/Notice/bbc12631-393c-4598-ae1b-639c310b65a6","target_id":"contracts-finder-recent-awards","url":"https://www.contractsfinder.service.gov.uk/Published/Notices/OCDS/Search?stages=award"},"status":"active","supplier":{"id":"entity:supplier:GB-CFS-62118","name":"First Stop Travel EA limited","role":"supplier","source_identifier":"GB-CFS-62118"},"suppliers":[{"id":"entity:supplier:GB-CFS-62118","name":"First Stop Travel EA limited","role":"supplier","source_identifier":"GB-CFS-62118"}],"title":"QBE025 09:00 2026-08-07 Cavendish to West Suffolk College (Minden House), Bury St Edmunds - 4-seater vehicle with a PA - AWARD","type":"award","value":{"amount":30096,"currency":"GBP"}}
