{"buyer":{"id":"entity:buyer:GB-CFS-309962","name":"Home Office","role":"buyer","source_identifier":"GB-CFS-309962"},"classification":{"category":"Content management software package","cpv":[{"code":"48783000","description":"Content management software package"}]},"dates":{"award":"2026-08-07T00:00:00+01:00","end":"2027-03-31T23:59:59+01:00","first_observed":"2026-08-13T15:29:21+00:00","first_observed_changed":null,"last_observed":"2026-08-14T03:29:49+00:00","published":"2026-08-13T13:05:32+01:00","start":"2026-08-07T00:00:00+01:00"},"evidence":{"observation_count":3,"observation_ids":["contracts-finder-recent-awards:poll:264","contracts-finder-recent-awards:poll:275","contracts-finder-recent-awards:poll:283"]},"id":"record:contracts-finder-recent-awards:ocds-b5fd17-8590e46d-ecb4-4c2e-9cd5-b0764a42e809","notice_type":"award","source":{"name":"Contracts Finder \u2014 recent awards","notice_url":"https://www.contractsfinder.service.gov.uk/Notice/3d1f7351-8c61-436d-a7c7-5bb650d00307","target_id":"contracts-finder-recent-awards","url":"https://www.contractsfinder.service.gov.uk/Published/Notices/OCDS/Search?stages=award"},"status":"active","supplier":{"id":"entity:supplier:GB-CFS-337502","name":"Voop Ltd.","role":"supplier","source_identifier":"GB-CFS-337502"},"suppliers":[{"id":"entity:supplier:GB-CFS-337502","name":"Voop Ltd.","role":"supplier","source_identifier":"GB-CFS-337502"}],"title":"Safeguard Smartphones for Children in Care","type":"award","value":{"amount":100000,"currency":"GBP"}}
