{"buyer":{"id":"entity:buyer:GB-PPON-PDQJ-7126-JDHG","name":"UK Research and Innovation","role":"buyer","source_identifier":"GB-PPON-PDQJ-7126-JDHG"},"classification":{"category":null,"cpv":[]},"dates":{"award":null,"end":null,"first_observed":"2026-08-12T15:26:12+00:00","first_observed_changed":"2026-08-12T21:27:49+00:00","last_observed":"2026-08-12T15:26:12+00:00","published":"2026-08-12T15:15:05+01:00","start":null},"evidence":{"observation_count":1,"observation_ids":["find-a-tender-recent-awards:poll:227"]},"id":"record:find-a-tender-recent-awards:ocds-h6vhtk-06e2d9","notice_type":"award","source":{"name":"Find a Tender \u2014 recent awards","notice_url":null,"target_id":"find-a-tender-recent-awards","url":"https://www.find-tender.service.gov.uk/api/1.0/ocdsReleasePackages"},"status":"active","supplier":{"id":"entity:supplier:GB-PPON-PTVN-1696-GLRX","name":"Parkpnp Ltd. t/a Wayleadr","role":"supplier","source_identifier":"GB-PPON-PTVN-1696-GLRX"},"suppliers":[{"id":"entity:supplier:GB-PPON-PTVN-1696-GLRX","name":"Parkpnp Ltd. t/a Wayleadr","role":"supplier","source_identifier":"GB-PPON-PTVN-1696-GLRX"}],"title":"DDaT26411 - Parking Software Solution","type":"award","value":null}
